<!ELEMENT Modulos (Modulo+)>
<!ELEMENT Modulo (Contenidos)>
<!ATTLIST Modulo nombre CDATA #REQUIRED>
<!ELEMENT Contenidos (UD+)>
<!ELEMENT UD (Nombre)>
<!ATTLIST UD tipo (Teorica | Practica) #REQUIRED
          descripcion CDATA #REQUIRED>
<!ELEMENT Nombre (#PCDATA)>
